{
  "schema_version": "v0.1",
  "generated_at": "2026-02-17T11:00:00Z",
  "portfolio_accounts": [
    {
      "id": "pf_main",
      "name": "Delphi Main Portfolio",
      "base_currency": "USD",
      "status": "active",
      "risk_policy_id": "rp_conservative"
    }
  ],
  "positions": [
    {
      "id": "pos_001",
      "portfolio_id": "pf_main",
      "market_id": "mkt_candidate_a_win",
      "outcome_id": "out_yes",
      "side": "long",
      "size": 1200,
      "avg_entry_price": 0.52,
      "mark_price": 0.57,
      "unrealized_pnl": 60,
      "status": "open"
    }
  ],
  "orders": [
    {
      "id": "ord_001",
      "portfolio_id": "pf_main",
      "market_id": "mkt_candidate_a_win",
      "outcome_id": "out_yes",
      "side": "buy",
      "order_type": "limit",
      "quantity": 500,
      "limit_price": 0.56,
      "status": "approved",
      "decision_record_id": "dec_001"
    }
  ],
  "executions": [
    {
      "id": "exe_001",
      "order_id": "ord_001",
      "timestamp": "2026-02-17T11:02:00Z",
      "filled_quantity": 500,
      "filled_price": 0.56,
      "tx_hash": "0xabc123example",
      "fee_usd": 4.8
    }
  ],
  "wallets": [
    {
      "id": "wlt_sim_001",
      "address": "0xSimulatedWallet0001",
      "chain": "Polygon",
      "custody_type": "simulation",
      "status": "enabled",
      "policy_id": "rp_conservative"
    }
  ],
  "risk_policies": [
    {
      "id": "rp_conservative",
      "name": "Conservative Policy",
      "max_position_usd": 10000,
      "max_daily_notional_usd": 20000,
      "max_market_exposure_pct": 0.25,
      "stop_loss_pct": 0.1,
      "requires_human_approval": true
    }
  ],
  "decision_records": [
    {
      "id": "dec_001",
      "market_id": "mkt_candidate_a_win",
      "outcome_id": "out_yes",
      "thesis": "Recent polling and liquidity trend support a moderate long position.",
      "confidence": 0.68,
      "evidence_refs": [
        "evt_us_election_2028",
        "pp_yes_20260217_1000",
        "news_evt_001"
      ],
      "proposed_action": "buy",
      "created_at": "2026-02-17T10:55:00Z",
      "created_by_agent": "strategy_agent_v1"
    }
  ]
}
